{
  
    "version": "1.0.0",
    "accountType": "company",
    "companydetails": {
      "companyname": "test",
      "asicregisteredname": "test",
      "acn": "007457141",
      "companyabn": "",
      "agreeconditions": "Verified",
      "industry": {
        "industry": "7412",
        "anzsiccode": "7412",
        "ucmcode": "SIC 0360"
      },
      "companyofficev2": {
        "country": "AU",
        "existingAddressList": [
          {
            "DisplayText": "78 Crimea Street, PARRAMATTA  NSW  2150",
            "country": "AU",
            "valid": true,
            "sameasaddress": "0",
            "AddressIdentifier": "0EOAUEHgvgBwAAAAAIAgEAAAAAm39mEAAhAA4AAAAAAAAAAAD..2QAAAAA.....wAAAAAAAAAAAAAAAAA3OCBjcmltZWEgc3RyZQA-"
          }
        ],
        "sameasaddress": "0",
        "addressType": "residential",
        "DisplayText": "78 Crimea Street, PARRAMATTA  NSW  2150",
        "AddressIdentifier": "0EOAUEHgvgBwAAAAAIAgEAAAAAm39mEAAhAA4AAAAAAAAAAAD..2QAAAAA.....wAAAAAAAAAAAAAAAAA3OCBjcmltZWEgc3RyZQA-",
        "valid": true
      },
      "placeofbusinessv2": {
        "DisplayText": "78 Crimea Street, PARRAMATTA  NSW  2150",
        "country": "AU",
        "valid": true,
        "sameasaddress": "0EOAUEHgvgBwAAAAAIAgEAAAAAm39mEAAhAA4AAAAAAAAAAAD..2QAAAAA.....wAAAAAAAAAAAAAAAAA3OCBjcmltZWEgc3RyZQA-",
        "addressType": "residential",
        "AddressIdentifier": "0EOAUEHgvgBwAAAAAIAgEAAAAAm39mEAAhAA4AAAAAAAAAAAD..2QAAAAA.....wAAAAAAAAAAAAAAAAA3OCBjcmltZWEgc3RyZQA-",
        "existingAddressList": [
          {
            "DisplayText": "78 Crimea Street, PARRAMATTA  NSW  2150",
            "country": "AU",
            "valid": true,
            "sameasaddress": "0",
            "AddressIdentifier": "0EOAUEHgvgBwAAAAAIAgEAAAAAm39mEAAhAA4AAAAAAAAAAAD..2QAAAAA.....wAAAAAAAAAAAAAAAAA3OCBjcmltZWEgc3RyZQA-"
          }
        ]
      },
      "taxdetails": {
        "ausTaxDetails": {
          "taxOption": {
            "value": "Tax File Number or exemption not provided",
            "valid": true
          },
          "exemptionReason": {
            "valid": true
          },
          "tfn": {
            "valid": false
          },
          "isTaxCountryAus": {
            "value": true,
            "valid": true
          }
        },
        "isOverseasTaxRes": {
          "value": false,
          "valid": true
        },
        "overseasTaxDetails": [
          
        ]
      },
      "docissuer": "ASIC",
      "issuedate": "28 Feb 2017",
      "documentnumber": "notapplicable",
      "verificationsource": "Website search",
      "englishtranslation": "notapplicable",
      "registeredforgst": "yes",
      "wealthsource": "Business income\/earnings",
      "personalinvestmententity": true
    },
    "directors": [
      {
        "title": "MR",
        "firstname": "test",
        "middlename": "",
        "lastname": "FIRST",
        "preferredname": "",
        "formername": "",
        "dateofbirth": "11\/11\/1988",
        "gender": "male",
        "mobile": {
          "value": "0451223442"
        },
        "email": {
          "value": "test@test.com"
        },
        "preferredcontact": "",
        "isvalid": false,
        "accountType": "company",
        "alternatename": "",
        "sameasresaddress": "true",
        "taxdetails": {
          "ausTaxDetails": {
            "isTaxCountryAus": {
              "value": true,
              "valid": true
            }
          },
          "isOverseasTaxRes": {
            "value": false,
            "valid": true
          },
          "overseasTaxDetails": [
            
          ]
        },
        "identitydocument": {
          
        },
        "resaddressv2": {
          "DisplayText": "78 Crimea Street, PARRAMATTA  NSW  2150",
          "country": "AU",
          "valid": true,
          "sameasaddress": "0EOAUEHgvgBwAAAAAIAgEAAAAAm39mEAAhAA4AAAAAAAAAAAD..2QAAAAA.....wAAAAAAAAAAAAAAAAA3OCBjcmltZWEgc3RyZQA-",
          "addressType": "residential",
          "AddressIdentifier": "0EOAUEHgvgBwAAAAAIAgEAAAAAm39mEAAhAA4AAAAAAAAAAAD..2QAAAAA.....wAAAAAAAAAAAAAAAAA3OCBjcmltZWEgc3RyZQA-",
          "existingAddressList": [
            {
              "DisplayText": "78 Crimea Street, PARRAMATTA  NSW  2150",
              "country": "AU",
              "valid": true,
              "sameasaddress": "0",
              "AddressIdentifier": "0EOAUEHgvgBwAAAAAIAgEAAAAAm39mEAAhAA4AAAAAAAAAAAD..2QAAAAA.....wAAAAAAAAAAAAAAAAA3OCBjcmltZWEgc3RyZQA-"
            }
          ]
        },
        "postaladdressv2": {
          "DisplayText": "78 Crimea Street, PARRAMATTA  NSW  2150",
          "country": "AU",
          "valid": true,
          "sameasaddress": "0EOAUEHgvgBwAAAAAIAgEAAAAAm39mEAAhAA4AAAAAAAAAAAD..2QAAAAA.....wAAAAAAAAAAAAAAAAA3OCBjcmltZWEgc3RyZQA-",
          "addressType": "postal",
          "AddressIdentifier": "0EOAUEHgvgBwAAAAAIAgEAAAAAm39mEAAhAA4AAAAAAAAAAAD..2QAAAAA.....wAAAAAAAAAAAAAAAAA3OCBjcmltZWEgc3RyZQA-",
          "existingAddressList": [
            {
              "DisplayText": "78 Crimea Street, PARRAMATTA  NSW  2150",
              "country": "AU",
              "valid": true,
              "sameasaddress": "0",
              "AddressIdentifier": "0EOAUEHgvgBwAAAAAIAgEAAAAAm39mEAAhAA4AAAAAAAAAAAD..2QAAAAA.....wAAAAAAAAAAAAAAAAA3OCBjcmltZWEgc3RyZQA-"
            }
          ]
        }
      }
    ],
    "accountsettings": {
      "professionalspayment": "linkedaccountsonly",
      "investorAccountSettings": [
        {
          "role": "director",
          "isApprover": "true",
          "paymentSetting": "linkedaccountsonly",
          "hasRoles": true,
          "hasApprovers": true
        }
      ],
      "primarycontact": 0,
      "adviserName": "Edward Revis",
      "adviserLocation": "New South Wales",
      "sourceoffunds": "Bonus",
      "powerofattorney": true
    },
    "shareholderandmembers": {
      "needsShareholder": true,
      "needsMember": false,
      "needsBeneficiary": false,
      "needsBeneficialOwner": true,
      "accountType": "company",
      "isMajorShareholder": "yes",
      "investorsWithRoles": [
        {
          "isShareholder": "yes",
          "needsShareholder": true,
          "needsMember": false,
          "needsBeneficiary": false,
          "role": "Director",
          "needsBeneficialOwner": true,
          "isMajorShareholder": "yes"
        }
      ],
      "additionalShareHoldersAndMembers": [
        
      ]
    },
    "linkedaccounts": {
      "primaryLinkedAccount": {
        "accountname": "test",
        "bsb": "063133",
        "accountnumber": "132343213",
        "bsbValidationResultVal": true
      },
      "otherLinkedAccount": [
        
      ]
    },
    "fees": {
      "estamount": "0.00",
      "ongoingFees": {
        "feesComponent": [
          
        ],
        "type": "Ongoing advice fee"
      }
    }
  }


