{
  "accountType": "joint",
  "approvalType": "online",
  "version": "1.0.0",
  "investors": [
    {
      "displayTaxOptions": true,
      "taxcountry": "AU",
      "taxoption": "Exemption Reason provided",
      "exemptionreason": "tax_exempt",
      "userName": "74943018",
      "idVerified": true,
      "registered": false,
      "tfnProvided": false,
      "investorType": "individual",
      "cisId": "71034910078",
      "title": "MR",
      "gcmTitleLabel": "Mr",
      "gender": "Male",
      "active": false,
      "accountType": "joint",
      "firstname": "Sdfsf",
      "lastname": "Sdfsf",
      "dateofbirth": "18/06/1988",
      "resaddress": {
        "state": "NSW",
        "city": "Sydney",
        "postcode": "2000",
        "countryCode": "AU",
        "country": "Australia",
        "domicile": true,
        "mailingAddress": true,
        "internationalAddress": false,
        "addressLine1": "275 Market Street",
        "standardAddressFormat": false
      },
      "postaladdress": {
        "state": "NSW",
        "city": "Sydney",
        "postcode": "2000",
        "countryCode": "AU",
        "country": "Australia",
        "domicile": true,
        "mailingAddress": true,
        "internationalAddress": false,
        "addressLine1": "275 Market Street",
        "standardAddressFormat": false
      },
      "isDuplicate": true,
      "mobile": {
        "value": "0412345678"
      },
      "email": {
        "value": "sdfsff@efsfd.com"
      },
      "contactdetails": {
        "value": "homenumber_04123456789",
        "label": "04 123 456 789"
      },
      "preferredcontact": "homenumber",
      "homenumber": {
        "areaCode": "04",
        "concatenatedNumber": "04123456789",
        "value": "123456789"
      },
      "isvalid": true
    },
    {
      "isvalid": true,
      "key": {
        "clientId": "1511C500CF7073650C5A9F7A657431294EC50DD43A7489D4"
      },
      "userName": "bae6-bd4f-c6",
      "emails": [
        {
          "email": "mail@mail.com",
          "preferred": false,
          "emailType": "Primary"
        }
      ],
      "phones": [
        {
          "preferred": true,
          "number": "0412344567",
          "phoneType": "Primary",
          "type": "Phone",
          "label": "Mobile - primary"
        }
      ],
      "idVerified": true,
      "registered": true,
      "tfnProvided": false,
      "exemptionreason": "norfolk_island_res",
      "personRoles": [
        "Owner"
      ],
      "gcmId": "237328674",
      "investorType": "INDIVIDUAL",
      "tfnExemptId": "99",
      "cisId": "44729910038",
      "title": "Mr",
      "gender": "Male",
      "accountType": "joint",
      "firstname": "Testone",
      "middlename": "Mid",
      "lastname": "Last",
      "preferredname": "Perff",
      "dateofbirth": "04 May 1990",
      "mobile": {
        "value": "0412344567"
      },
      "email": {
        "value": "mail@mail.com"
      },
      "isDuplicate": true
    },
    {
      "displayTaxOptions": true,
      "cismandatory": true,
      "title": "MR",
      "firstname": "eeee",
      "middlename": "eeee",
      "lastname": "eee",
      "preferredname": "eee",
      "formername": "",
      "dateofbirth": "03/03/1978",
      "gender": "male",
      "mobile": {
        "value": "0433232323"
      },
      "email": {
        "value": "sssss@mail.com"
      },
      "preferredcontact": "mobile",
      "isvalid": true,
      "accountType": "joint",
      "alternatename": "eeee",
      "wealthsource": "Business profits",
      "identitydocument": {
        "photodocuments": {
          "agecard": {
            "documentIssuer": "ACT",
            "verificationSource": "original",
            "englishTranslation": "Not Applicable",
            "documentNumber": "w333333",
            "expiryDate": "04/04/2030",
            "accreditedenglishtrans": "notapplicable"
          },
          "valid": true
        }
      },
      "resaddress": {
        "componentised": true,
        "unitNumber": "",
        "streetNumber": "",
        "streetName": "Dddd",
        "suburb": "SYDNEY",
        "state": "NSW",
        "postcode": "2000",
        "country": "AU",
        "verified": true,
        "addressType": "residential",
        "existingAddressList": [
          {
            "componentised": true,
            "unitNumber": "",
            "streetNumber": "",
            "streetName": "Dddd",
            "suburb": "SYDNEY",
            "state": "NSW",
            "postcode": "2000",
            "country": "AU",
            "verified": true,
            "confirmed": true,
            "valid": true,
            "sameasaddress": "0",
            "addressType": "residential",
            "id": "775834"
          }
        ],
        "sameasaddress": "0",
        "confirmed": true,
        "valid": true
      },
      "postaladdress": {
        "componentised": true,
        "unitNumber": "",
        "streetNumber": "",
        "streetName": "Dddd",
        "suburb": "SYDNEY",
        "state": "NSW",
        "postcode": "2000",
        "country": "AU",
        "verified": true,
        "confirmed": true,
        "valid": true,
        "sameasaddress": "430640",
        "addressType": "residential",
        "id": "430640",
        "existingAddressList": [
          {
            "componentised": true,
            "unitNumber": "",
            "streetNumber": "",
            "streetName": "Dddd",
            "suburb": "SYDNEY",
            "state": "NSW",
            "postcode": "2000",
            "country": "AU",
            "verified": true,
            "confirmed": true,
            "valid": true,
            "sameasaddress": "0",
            "addressType": "residential",
            "id": "430640"
          }
        ]
      },
      "taxcountry": "AU",
      "taxoption": "Tax File Number or exemption not provided"
    }
  ],
  "accountsettings": {
    "professionalspayment": "linkedaccountsonly",
    "investorAccountSettings": [
      {
        "paymentSetting": "linkedaccountsonly",
        "hasRoles": false,
        "hasApprovers": false
      },
      {
        "paymentSetting": "nopayments",
        "hasRoles": false,
        "hasApprovers": false
      },
      {
        "paymentSetting": "allpayments",
        "hasRoles": false,
        "hasApprovers": false
      }
    ],
    "primarycontact": 0,
    "adviserName": "Michelle Hicks",
    "adviserLocation": "South Australia",
    "sourceoffunds": "Business profits"
  },
  "linkedaccounts": {
    "primaryLinkedAccount": {
      "accountname": "ddddd",
      "bsb": "082124",
      "accountnumber": "3647343",
      "bsbValidationResultVal": true
    },
    "otherLinkedAccount": []
  },
  "fees": {
    "estamount": "3.00",
    "ongoingFees": {
      "feesComponent": [
        {
          "listedSecurities": "1.00",
          "managedFund": "0.00",
          "managedPortfolio": "0.00",
          "termDeposit": "0.00",
          "cash": "0.00",
          "label": "Percentage fee component",
          "valid": true
        }
      ],
      "type": "Ongoing advice fee"
    },
    "licenseeFees": {
      "feesComponent": [
        {
          "termDeposit": "true",
          "slidingScaleFeeTier": [
            {
              "lowerBound": "0.00",
              "upperBound": "11111.00",
              "percentage": "1.00"
            },
            {
              "lowerBound": "11111.00",
              "upperBound": "",
              "percentage": "1.00"
            }
          ],
          "label": "Sliding scale fee component"
        }
      ],
      "type": "Licensee advice fee"
    }
  }
}