{
  "version": "1.0.0",
  "accountType": "superPension",
  "pensioneligibility": {
    "conditionRelease": "oth",
    "eligibilityCriteria": "unpsv"
  },
  "investors": [
    {
      "emails": [

      ],
      "personRoles": [

      ],
      "phones": [

      ],
      "displayTaxOptions": true,
      "cismandatory": true,
      "wealthsource": "Business profits",
      "title": "MR",
      "firstname": "Robert",
      "middlename": "",
      "lastname": "Diego",
      "preferredname": "",
      "formername": "",
      "dateofbirth": "02\/02\/1935",
      "gender": "male",
      "mobile": {
        "value": "0425836901"
      },
      "email": {
        "value": "diego@test.com"
      },
      "preferredcontact": "mobile",
      "isvalid": true,
      "alternatename": "",
      "accountType": "superPension",
      "identitydocument": {
        "photodocuments": {
          "driverlicence": {
            "documentIssuer": "NSW",
            "expiryDate": "01\/10\/2017",
            "documentNumber": "25896314",
            "verificationSource": "original",
            "englishTranslation": "Not Applicable",
            "accreditedenglishtrans": "notapplicable"
          },
          "valid": true
        }
      },
      "resaddress": {
        "componentised": true,
        "addressType": "residential",
        "unitNumber": "",
        "streetNumber": "135-151",
        "streetName": "Clarence",
        "streetType": "STREET",
        "suburb": "SYDNEY",
        "state": "NSW",
        "postcode": "2000",
        "country": "AU",
        "id": "552983",
        "sameasaddress": "552983",
        "confirmed": true,
        "valid": true,
        "verified": true,
        "existingAddressList": [
          {
            "componentised": true,
            "addressType": "residential",
            "unitNumber": "",
            "streetNumber": "135-151",
            "streetName": "Clarence",
            "streetType": "STREET",
            "suburb": "SYDNEY",
            "state": "NSW",
            "postcode": "2000",
            "country": "AU",
            "id": "552983",
            "sameasaddress": "0",
            "confirmed": true,
            "valid": true,
            "verified": true,
            "existingAddressList": [

            ]
          }
        ]
      },
      "postaladdress": {
        "componentised": true,
        "addressType": "residential",
        "unitNumber": "",
        "streetNumber": "135-151",
        "streetName": "Clarence",
        "streetType": "STREET",
        "suburb": "SYDNEY",
        "state": "NSW",
        "postcode": "2000",
        "country": "AU",
        "id": "408118",
        "sameasaddress": "408118",
        "confirmed": true,
        "valid": true,
        "verified": true,
        "existingAddressList": [
          {
            "componentised": true,
            "addressType": "residential",
            "unitNumber": "",
            "streetNumber": "135-151",
            "streetName": "Clarence",
            "streetType": "STREET",
            "suburb": "SYDNEY",
            "state": "NSW",
            "postcode": "2000",
            "country": "AU",
            "id": "408118",
            "sameasaddress": "0",
            "confirmed": true,
            "valid": true,
            "verified": true,
            "existingAddressList": [

            ]
          }
        ]
      },
      "taxcountry": "AU",
      "taxoption": "pensioner"
    }
  ],
  "accountsettings": {
    "professionalspayment": "linkedaccountsonly",
    "investorAccountSettings": [
      {
        "paymentSetting": "nopayments",
        "hasRoles": false,
        "hasApprovers": false
      }
    ],
    "primarycontact": 0,
    "adviserName": "Marco Kwok",
    "adviserLocation": "Western Australia",
    "sourceoffunds": "Business profits"
  },
  "linkedaccounts": {
    "primaryLinkedAccount": {
      "accountname": "TestAccount",
      "bsb": "062001",
      "accountnumber": "25896314",
      "nickname": "",
      "bsbValidationResultVal": true
    },
    "otherLinkedAccount": [

    ]
  },
  "fees": {
    "estamount": "0.00",
    "ongoingFees": {
      "feesComponent": [

      ],
      "type": "Ongoing advice fee"
    },
    "licenseeFees": {
      "feesComponent": [

      ],
      "type": "Licensee advice fee"
    }
  }
}