{
  "accountType": "newCorporateSMSF",
  "approvalType": "online",
  "version": "1.0.0",
  "smsfdetails": {
    "smsfabn": "",
    "regdate": "",
    "registeredforgst": "yes",
    "industry": {
      "industry": "7412",
      "anzsiccode": "7412",
      "ucmcode": "SIC 0360"
    },
    "wealthsource": "Additional Sources",
    "additionalsourceofwealth": "Money Laundering",
    "smsfname": "The New Corporate SMSF",
    "smsfaddress": {
      "componentised": true,
      "unitNumber": "",
      "streetNumber": "28",
      "streetName": "West",
      "streetType": "STREET",
      "suburb": "NORTH SYDNEY",
      "state": "NSW",
      "postcode": "2060",
      "country": "AU",
      "verified": true,
      "addressType": "residential",
      "existingAddressList": [
        {
          "componentised": true,
          "unitNumber": "",
          "streetNumber": "28",
          "streetName": "West",
          "streetType": "STREET",
          "suburb": "NORTH SYDNEY",
          "state": "NSW",
          "postcode": "2060",
          "country": "AU",
          "verified": true,
          "confirmed": true,
          "valid": true,
          "sameasaddress": "0",
          "addressType": "residential",
          "id": "845379"
        }
      ],
      "sameasaddress": "0",
      "confirmed": false,
      "valid": true
    },
    "registrationstate": "NSW"
  },
  "companytrustee": {
    "companyname": "The Trustee Company",
    "asicregisteredname": "dsdssds",
    "industry": {
      "industry": "7412",
      "anzsiccode": "7412",
      "ucmcode": "SIC 0360"
    },
    "companyoffice": {
      "componentised": true,
      "unitNumber": "",
      "streetNumber": "28",
      "streetName": "West",
      "streetType": "STREET",
      "suburb": "NORTH SYDNEY",
      "state": "NSW",
      "postcode": "2060",
      "country": "AU",
      "verified": true,
      "addressType": "residential",
      "existingAddressList": [
        {
          "componentised": true,
          "unitNumber": "",
          "streetNumber": "28",
          "streetName": "West",
          "streetType": "STREET",
          "suburb": "NORTH SYDNEY",
          "state": "NSW",
          "postcode": "2060",
          "country": "AU",
          "verified": true,
          "confirmed": true,
          "valid": true,
          "sameasaddress": "0",
          "addressType": "residential",
          "id": "476281"
        }
      ],
      "sameasaddress": "0",
      "confirmed": true,
      "valid": true
    },
    "placeofbusiness": {
      "componentised": true,
      "unitNumber": "",
      "streetNumber": "28",
      "streetName": "West",
      "streetType": "STREET",
      "suburb": "NORTH SYDNEY",
      "state": "NSW",
      "postcode": "2060",
      "country": "AU",
      "verified": true,
      "addressType": "residential",
      "existingAddressList": [
        {
          "componentised": true,
          "unitNumber": "",
          "streetNumber": "28",
          "streetName": "West",
          "streetType": "STREET",
          "suburb": "NORTH SYDNEY",
          "state": "NSW",
          "postcode": "2060",
          "country": "AU",
          "verified": true,
          "confirmed": true,
          "valid": true,
          "sameasaddress": "0",
          "addressType": "residential",
          "id": "179656"
        }
      ],
      "sameasaddress": "0",
      "confirmed": false,
      "valid": true
    }
  },
  "directors": [
    {
      "isvalid": true,
      "key": {
        "clientId": "4E9F4BF67C010872107B51D427BACE10B33A0FA404360F2D"
      },
      "userName": "",
      "emails": [
        {
          "email": "TestCoreSMSFfivetwosixteen@email.com",
          "preferred": false,
          "emailType": "Primary"
        }
      ],
      "phones": [
        {
          "preferred": true,
          "number": "0425462316",
          "phoneType": "Primary",
          "type": "Phone",
          "label": "Mobile - primary"
        }
      ],
      "idVerified": true,
      "registered": true,
      "tfnProvided": true,
      "exemptionreason": "norfolk_island_res",
      "personRoles": [
        "Owner"
      ],
      "gcmId": "237329650",
      "investorType": "INDIVIDUAL",
      "tfnExemptId": "99",
      "cisId": "20444910070",
      "title": "Mr",
      "gcmTitleLabel": "Mr",
      "gender": "Male",
      "accountType": "newCorporateSMSF",
      "firstname": "Testcoresmsffivetwosixteen",
      "formername": "Ssdsdsdd",
      "lastname": "First",
      "preferredname": "Prefname",
      "dateofbirth": "01 May 1986",
      "mobile": {
        "value": "0425462316"
      },
      "email": {
        "value": "TestCoreSMSFfivetwosixteen@email.com"
      },
      "isDuplicate": true,
      "eligibletrustee": "Confirmed",
      "placeofbirth": {
        "placeofbirthcountry": "AL",
        "placeofbirthinternationalcity": "AAAAA",
        "placeofbirthinternationalprovince": "AAAA"
      }
    },
    {
      "isvalid": false,
      "key": {
        "clientId": "C4C7EB6CB26186561F4A21ED048C69B6B0E61BFD17B480F3"
      },
      "userName": "",
      "emails": [
        {
          "email": "mail@mail.com",
          "preferred": false,
          "emailType": "Primary"
        }
      ],
      "phones": [
        {
          "preferred": true,
          "number": "0412345678",
          "phoneType": "Primary",
          "type": "Phone",
          "label": "Mobile - primary"
        }
      ],
      "idVerified": true,
      "registered": true,
      "tfnProvided": true,
      "exemptionreason": "norfolk_island_res",
      "personRoles": [
        "Owner"
      ],
      "gcmId": "237329696",
      "investorType": "INDIVIDUAL",
      "tfnExemptId": "99",
      "cisId": "99829910033",
      "title": "Mr",
      "gcmTitleLabel": "Mr",
      "gender": "Male",
      "accountType": "newCorporateSMSF",
      "firstname": "Testoneuser",
      "formername": "TestFormerNAme",
      "lastname": "Last",
      "preferredname": "Perff",
      "dateofbirth": "09 Aug 1990",
      "mobile": {
        "value": "0412345678"
      },
      "email": {
        "value": "mail@mail.com"
      },
      "isDuplicate": true,
      "placeofbirth": {
        "placeofbirthcountry": "AU",
        "placeofbirthsuburb": "AAAAAAA",
        "placeofbirthstate": "NSW"
      }
    }
  ],
  "accountsettings": {
    "professionalspayment": "allpayments",
    "investorAccountSettings": [
      {
        "isApprover": "true",
        "paymentSetting": "nopayments",
        "hasRoles": false,
        "hasApprovers": true
      },
      {
        "isApprover": "true",
        "paymentSetting": "linkedaccountsonly",
        "hasRoles": false,
        "hasApprovers": true
      }
    ],
    "primarycontact": 0,
    "adviserName": "Michelle Hicks",
    "adviserLocation": "South Australia",
    "sourceoffunds": "Business profits"
  },
  "shareholderandmembers": {
    "needsShareholder": true,
    "needsMember": true,
    "needsBeneficiary": false,
    "needsBeneficialOwner": false,
    "accountType": "newCorporateSMSF",
    "investorsWithRoles": [
      {
        "isMember": "no",
        "isShareholder": "yes",
        "needsShareholder": true,
        "needsMember": true,
        "needsBeneficiary": false,
        "needsBeneficialOwner": false
      },
      {
        "isMember": "yes",
        "isShareholder": "yes",
        "needsShareholder": true,
        "needsMember": true,
        "needsBeneficiary": false,
        "needsBeneficialOwner": false
      }
    ],
    "additionalShareHoldersAndMembers": []
  },
  "linkedaccounts": {
    "primaryLinkedAccount": {
      "accountname": "sdsds",
      "bsb": "32323",
      "accountnumber": "232323",
      "nickname": "32323",
      "directdebitamount": "232.00"
    },
    "otherLinkedAccount": []
  },
  "fees": {
    "estamount": "0.00",
    "ongoingFees": {
      "feesComponent": [],
      "type": "Ongoing advice fee"
    },
    "licenseeFees": {
      "feesComponent": [],
      "type": "Licensee advice fee"
    }
  }
}