{
         "version":"1.0.0",
         "accountType":"individualTrust",
         "trustType":"family",
         "trustdetails":{
            "trustname":"test",
            "businessname":"test",
            "regdate":"11/11/1990",
            "registrationstate":"NSW",
            "registeredforgst":"yes",
            "settloroftrust":"organisation",
            "wealthsource":"Business profits",
            "abn":"",
            "trusttype":"family",
            "organisationName":"test",
            "industry":{
               "anzsiccode":"7412",
               "industry":"7412",
               "ucmcode":"SIC 0360"
            },
            "addressv2":{
               "addressType":"residential",
               "country":"AU",
               "sameasaddress":"0",
               "valid":true,
               "DisplayText":"78 Crimea Street, PARRAMATTA  NSW  2150",
               "AddressIdentifier":"0DOAUEHwjgBwAAAAAIAgEAAAAAmhq80AAhAA4AAAAAAAAAAAD..2QAAAAA.....wAAAAAAAAAAAAAAAAA3OCBjcmltZWEgc3RyZQA-",
               "existingAddressList":[
                  {
                     "country":"AU",
                     "sameasaddress":"0",
                     "valid":true,
                     "DisplayText":"78 Crimea Street, PARRAMATTA  NSW  2150",
                     "AddressIdentifier":"0DOAUEHwjgBwAAAAAIAgEAAAAAmhq80AAhAA4AAAAAAAAAAAD..2QAAAAA.....wAAAAAAAAAAAAAAAAA3OCBjcmltZWEgc3RyZQA-",
                     "existingAddressList":[

                     ]
                  }
               ]
            },
            "trustverification":{
               "identitydocument":"trustdeed",
               "trustdeed":{
                  "fullname":"fdfdgfdgfdg",
                  "documentdate":"11/11/2016",
                  "verifiedfrom":"certifiedcopy"
               }
            },
            "taxdetails":{
               "ausTaxDetails":{
                  "tfn":{
                     "valid":false
                  },
                  "taxOption":{
                     "valid":true,
                     "value":"Tax File Number or exemption not provided"
                  },
                  "isTaxCountryAus":{
                     "valid":true,
                     "value":true
                  },
                  "exemptionReason":{
                     "valid":true
                  }
               },
               "isOverseasTaxRes":{
                  "valid":true,
                  "value":false
               },
               "overseasTaxDetails":[

               ]
            },
            "personalinvestmententity":true
         },
         "trustees":[
            {
               "emails":[

               ],
               "personRoles":[

               ],
               "phones":[

               ],
               "taxdetails":{
                  "ausTaxDetails":{
                     "isTaxCountryAus":{
                        "valid":true,
                        "value":true
                     }
                  },
                  "isOverseasTaxRes":{
                     "valid":true,
                     "value":false
                  },
                  "overseasTaxDetails":[

                  ]
               },
               "title":"MR",
               "firstname":"test",
               "middlename":"",
               "lastname":"one",
               "preferredname":"",
               "formername":"",
               "dateofbirth":"11/11/1988",
               "gender":"male",
               "mobile":{
                  "value":"0451223442"
               },
               "email":{
                  "value":"test@test.com"
               },
               "preferredcontact":"email",
               "isvalid":true,
               "alternatename":"",
               "accountType":"individualTrust",
               "identitydocument":{
                  "internationaldocuments":{
                     "nationalid":{
                        "documentIssuer":"DZ",
                        "issueDate":"23/02/2017",
                        "documentNumber":"54645645645",
                        "verificationSource":"certifiedcopy",
                        "englishTranslation":"notapplicable"
                     },
                     "valid":true
                  }
               },
               "resaddressv2":{
                  "addressType":"residential",
                  "country":"AU",
                  "sameasaddress":"0DOAUEHwjgBwAAAAAIAgEAAAAAmhq80AAhAA4AAAAAAAAAAAD..2QAAAAA.....wAAAAAAAAAAAAAAAAA3OCBjcmltZWEgc3RyZQA-",
                  "valid":true,
                  "DisplayText":"78 Crimea Street, PARRAMATTA  NSW  2150",
                  "AddressIdentifier":"0DOAUEHwjgBwAAAAAIAgEAAAAAmhq80AAhAA4AAAAAAAAAAAD..2QAAAAA.....wAAAAAAAAAAAAAAAAA3OCBjcmltZWEgc3RyZQA-",
                  "existingAddressList":[
                     {
                        "country":"AU",
                        "sameasaddress":"0",
                        "valid":true,
                        "DisplayText":"78 Crimea Street, PARRAMATTA  NSW  2150",
                        "AddressIdentifier":"0DOAUEHwjgBwAAAAAIAgEAAAAAmhq80AAhAA4AAAAAAAAAAAD..2QAAAAA.....wAAAAAAAAAAAAAAAAA3OCBjcmltZWEgc3RyZQA-",
                        "existingAddressList":[

                        ]
                     }
                  ]
               },
               "postaladdressv2":{
                  "addressType":"postal",
                  "country":"AU",
                  "sameasaddress":"0DOAUEHwjgBwAAAAAIAgEAAAAAmhq80AAhAA4AAAAAAAAAAAD..2QAAAAA.....wAAAAAAAAAAAAAAAAA3OCBjcmltZWEgc3RyZQA-",
                  "valid":true,
                  "DisplayText":"78 Crimea Street, PARRAMATTA  NSW  2150",
                  "AddressIdentifier":"0DOAUEHwjgBwAAAAAIAgEAAAAAmhq80AAhAA4AAAAAAAAAAAD..2QAAAAA.....wAAAAAAAAAAAAAAAAA3OCBjcmltZWEgc3RyZQA-",
                  "existingAddressList":[
                     {
                        "country":"AU",
                        "sameasaddress":"0",
                        "valid":true,
                        "DisplayText":"78 Crimea Street, PARRAMATTA  NSW  2150",
                        "AddressIdentifier":"0DOAUEHwjgBwAAAAAIAgEAAAAAmhq80AAhAA4AAAAAAAAAAAD..2QAAAAA.....wAAAAAAAAAAAAAAAAA3OCBjcmltZWEgc3RyZQA-",
                        "existingAddressList":[

                        ]
                     }
                  ]
               },
               "sameasresaddress":"true"
            }
         ],
         "shareholderandmembers":{
            "needsShareholder":false,
            "needsMember":false,
            "needsBeneficiary":true,
            "accountType":"individualTrust",
            "investorsWithRoles":[
               {
                  "needsShareholder":false,
                  "needsMember":false,
                  "needsBeneficiary":true
               }
            ],
            "additionalShareHoldersAndMembers":[

            ]
         },
         "accountsettings":{
            "professionalspayment":"linkedaccountsonly",
            "investorAccountSettings":[
               {
                  "paymentSetting":"linkedaccountsonly",
                  "hasRoles":false,
                  "hasApprovers":true,
                  "isApprover":"true"
               }
            ],
            "primarycontact":0,
            "adviserName":"Edward Revis",
            "adviserLocation":"New South Wales",
            "sourceoffunds":"Business income/earnings",
            "powerofattorney":false
         },
         "linkedaccounts":{
            "primaryLinkedAccount":{

            },
            "otherLinkedAccount":[

            ]
         },
         "fees":{
            "estamount":"0.00",
            "ongoingFees":{
               "feesComponent":[

               ],
               "type":"Ongoing advice fee"
            }
         }
      }
